{
  "$schema": "https://json-schema.org/draft/2020-12/schema",
  "$id": "https://wiki-spike.local/schemas/second-brain/unified-db-live-export-plan-conformance-v1.schema.json",
  "title": "Second Brain Unified-DB Live Export Plan Conformance V1",
  "type": "object",
  "additionalProperties": false,
  "required": [
    "approved_mapping_count",
    "body_present",
    "cutover_eligible",
    "dsn_read",
    "evidence_version",
    "import_invoked",
    "live_export_authorized",
    "private_key_material",
    "production_registry_empty",
    "serving_promotion",
    "source_mutation"
  ],
  "properties": {
    "evidence_version": {
      "const": "second-brain-unified-db-live-export-plan-conformance-v1"
    },
    "approved_mapping_count": {
      "const": "0"
    },
    "body_present": {
      "const": false
    },
    "cutover_eligible": {
      "const": false
    },
    "dsn_read": {
      "const": false
    },
    "import_invoked": {
      "const": false
    },
    "live_export_authorized": {
      "const": false
    },
    "private_key_material": {
      "const": false
    },
    "production_registry_empty": {
      "const": true
    },
    "serving_promotion": {
      "const": false
    },
    "source_mutation": {
      "const": false
    }
  }
}
